f_index,Faculty,Title,Year,Journal
32,Li Fang Flora,"Correction: Shupeng, W., et al. Carbon Dioxide Retrieval from TanSat Observations and Validation with TCCON Measurements. Remote Sensing 2020, 12(14), 2204.",2020,Remote. Sens.
32,Li Fang Flora,Biclustering high-frequency MeSH terms based on the co-occurrence of distinct semantic types in a MeSH tree.,2020,Scientometrics
32,Li Fang Flora,Glacier Surface Motion Estimation from SAR Intensity Images Based on Subpixel Gradient Correlation.,2020,Sensors
32,Li Fang Flora,Semantic based autoencoder-attention 3D reconstruction network.,2019,Graph. Model.
32,Li Fang Flora,Evapotranspiration Data Product from NESDIS GET-D System Upgraded for GOES-16 ABI Observations.,2019,Remote. Sens.
32,Li Fang Flora,Deep Clustering With Intra-class Distance Constraint for Hyperspectral Images.,2019,CoRR
32,Li Fang Flora,NextSV: a meta-caller for structural variants from low-coverage long-read sequencing data.,2018,BMC Bioinform.
32,Li Fang Flora,Research on multimodal human-robot interaction based on speech and gesture.,2018,Comput. Electr. Eng.
32,Li Fang Flora,Design of linear-phase nonsubsampled nonuniform directional filter bank with arbitrary directional partitioning.,2018,J. Vis. Commun. Image Represent.
32,Li Fang Flora,An Assessment of the Impact of Land Thermal Infrared Observation on Regional Weather Forecasts Using Two Different Data Assimilation Approaches.,2018,Remote. Sens.
32,Li Fang Flora,Design of oversampled nonuniform filter banks with arbitrary rational frequency partitioning.,2017,Signal Image Video Process.
32,Li Fang Flora,Discriminative Features Based on Two Layers Sparse Learning for Glacier Area Classification Using SAR Intensity Imagery.,2017,IEEE J. Sel. Top. Appl. Earth Obs. Remote. Sens.
32,Li Fang Flora,An inter-comparison of soil moisture data products from satellite remote sensing and a land surface model.,2016,Int. J. Appl. Earth Obs. Geoinformation
32,Li Fang Flora,"Design of
      
       M
      
      -channel linear-phase non-uniform filter banks with arbitrary rational sampling factors.",2016,IET Signal Process.
32,Li Fang Flora,Changes in Aerosol Optical and Micro-Physical Properties over Northeast Asia from a Severe Dust Storm in April 2014.,2016,Remote. Sens.
32,Li Fang Flora,A case study for intercomparison of land surface temperature retrieved from GOES and MODIS.,2015,Int. J. Digit. Earth
32,Li Fang Flora,Retrieval of Aerosol Properties for Fine/Coarse Mode Aerosol Mixtures over Beijing from PARASOL Measurements.,2015,Remote. Sens.
32,Li Fang Flora,New Retrieval Algorithm for Deriving Land Surface Temperature From Geostationary Orbiting Satellite Observations.,2014,IEEE Trans. Geosci. Remote. Sens.
32,Li Fang Flora,Effect of Different MODIS Emissivity Products on Land-Surface Temperature Retrieval From GOES Series.,2013,IEEE Geosci. Remote. Sens. Lett.
32,Li Fang Flora,Separating vegetation and soil temperature using airborne multiangular remote sensing image data.,2012,Int. J. Appl. Earth Obs. Geoinformation
32,Li Fang Flora,Use of NDVI dataset for a GIS based analysis: A sample study of TAR Creek superfund site.,2010,Ecol. Informatics
35,Liang Qianhui,DCEM: A data cell evolution model for service composition based on bigraph theory.,2020,Future Gener. Comput. Syst.
35,Liang Qianhui,Quantifying Legibility of Indoor Spaces Using Deep Convolutional Neural Networks: Case Studies in Train Stations.,2019,CoRR
35,Liang Qianhui,Uncovering Dominant Social Class in Neighborhoods through Building Footprints: A Case Study of Residential Zones in Massachusetts using Computer Vision.,2019,CoRR
35,Liang Qianhui,A rule-based approach for availability of service by automated service substitution.,2014,Softw. Pract. Exp.
35,Liang Qianhui,A Study of Software Metric Selection Techniques: stability Analysis and Defect Prediction Model Performance.,2013,Int. J. Artif. Intell. Tools
35,Liang Qianhui,Randomisation in designing software tests for systems of systems.,2012,Int. J. Inf. Decis. Sci.
35,Liang Qianhui,SOA Performance Enhancement Through XML Fragment Caching.,2012,Inf. Syst. Res.
35,Liang Qianhui,Interactive and Iterative Service-Composition-Based Approach to Flexible Information System Development.,2011,Int. J. Web Serv. Res.
35,Liang Qianhui,A high-performing comprehensive learning algorithm for text classification without pre-labeled training set.,2011,Knowl. Inf. Syst.
35,Liang Qianhui,Ontology-Based Business Process Customization for Composite Web Services.,2011,IEEE Trans. Syst. Man Cybern. Part A
35,Liang Qianhui,A Random Decision Tree Ensemble for Mining Concept Drifts from Noisy Data Streams.,2010,Appl. Artif. Intell.
35,Liang Qianhui,Rule randomisation and its application to logic-based workflow verification.,2009,Int. J. Inf. Decis. Sci.
35,Liang Qianhui,Optimizing Service Systems Based on Application-Level QoS.,2009,IEEE Trans. Serv. Comput.
35,Liang Qianhui,Modeling semantics in composite Web service requests by utility elicitation.,2007,Knowl. Inf. Syst.
35,Liang Qianhui,AND/OR Graph and Search Algorithm for Discovering Composite Web Services.,2005,Int. J. Web Serv. Res.
35,Liang Qianhui,"A Semi-Automatic Approach to Composite Web Services Discovery, Description and Invocation.",2004,Int. J. Web Serv. Res.
35,Liang Qianhui,A Combined Approach to Text-Dependent Speaker Identification: Comparison with Pure Neural Net Approaches.,1998,J. Circuits Syst. Comput.
37,Lin Guosheng,CycleSegNet: Object Co-segmentation with Cycle Refinement and Region Correspondence.,2021,CoRR
37,Lin Guosheng,Progressive Self-Guided Loss for Salient Object Detection.,2021,CoRR
37,Lin Guosheng,Online Active Proposal Set Generation for Weakly Supervised Object Detection.,2021,CoRR
37,Lin Guosheng,Bottom-Up Scene Text Detection with Markov Clustering Networks.,2020,Int. J. Comput. Vis.
37,Lin Guosheng,RefineNet: Multi-Path Refinement Networks for Dense Prediction.,2020,IEEE Trans. Pattern Anal. Mach. Intell.
37,Lin Guosheng,Motion Context Network for Weakly Supervised Object Detection in Videos.,2020,IEEE Signal Process. Lett.
37,Lin Guosheng,RGBD Salient Object Detection via Disentangled Cross-Modal Fusion.,2020,IEEE Trans. Image Process.
37,Lin Guosheng,Video Object Segmentation and Tracking: A Survey.,2020,ACM Trans. Intell. Syst. Technol.
37,Lin Guosheng,A Dilated Inception Network for Visual Saliency Prediction.,2020,IEEE Trans. Multim.
37,Lin Guosheng,DeepEMD: Few-Shot Image Classification with Differentiable Earth Mover's Distance and Structured Classifiers.,2020,CoRR
37,Lin Guosheng,Exploring Bottom-up and Top-down Cues with Attentive Learning for Webly Supervised Object Detection.,2020,CoRR
37,Lin Guosheng,CRNet: Cross-Reference Networks for Few-Shot Segmentation.,2020,CoRR
37,Lin Guosheng,Multi-Path Region Mining For Weakly Supervised 3D Semantic Segmentation on Point Clouds.,2020,CoRR
37,Lin Guosheng,Decomposed Generation Networks with Structure Prediction for Recipe Generation from Food Images.,2020,CoRR
37,Lin Guosheng,Open Set Recognition with Conditional Probabilistic Generative Models.,2020,CoRR
37,Lin Guosheng,Graph Edit Distance Reward: Learning to Edit Scene Graph.,2020,CoRR
37,Lin Guosheng,Structure-Aware Generation Network for Recipe Generation from Images.,2020,CoRR
37,Lin Guosheng,Feature Flow: In-network Feature Flow Estimation for Video Object Detection.,2020,CoRR
37,Lin Guosheng,LAGNet: Logic-Aware Graph Network for Human Interaction Understanding.,2020,CoRR
37,Lin Guosheng,On Lightweight Privacy-Preserving Collaborative Learning for Internet of Things by Independent Random Projections.,2020,CoRR
37,Lin Guosheng,Compositional Prototype Network with Multi-view Comparision for Few-Shot Point Cloud Semantic Segmentation.,2020,CoRR
37,Lin Guosheng,Local fusion networks with chained residual pooling for video action recognition.,2019,Image Vis. Comput.
37,Lin Guosheng,Keypoint based weakly supervised human parsing.,2019,Image Vis. Comput.
37,Lin Guosheng,Semantics-Aware Visual Object Tracking.,2019,IEEE Trans. Circuits Syst. Video Technol.
37,Lin Guosheng,Decoupled Spatial Neural Attention for Weakly Supervised Semantic Segmentation.,2019,IEEE Trans. Multim.
37,Lin Guosheng,On Lightweight Privacy-Preserving Collaborative Learning for IoT Objects.,2019,CoRR
37,Lin Guosheng,CANet: Class-Agnostic Segmentation Networks with Iterative Refinement and Attentive Few-Shot Learning.,2019,CoRR
37,Lin Guosheng,Towards Robust Curve Text Detection with Conditional Spatial Expansion.,2019,CoRR
37,Lin Guosheng,A Dilated Inception Network for Visual Saliency Prediction.,2019,CoRR
37,Lin Guosheng,Video Object Segmentation and Tracking: A Survey.,2019,CoRR
37,Lin Guosheng,Exploring Context with Deep Structured Models for Semantic Segmentation.,2018,IEEE Trans. Pattern Anal. Mach. Intell.
37,Lin Guosheng,Efficient dense labelling of human activity sequences from wearables using fully convolutional networks.,2018,Pattern Recognit.
37,Lin Guosheng,Crowd Counting via Weighted VLAD on a Dense Attribute Feature Map.,2018,IEEE Trans. Circuits Syst. Video Technol.
37,Lin Guosheng,Structured Learning of Tree Potentials in CRF for Image Segmentation.,2018,IEEE Trans. Neural Networks Learn. Syst.
37,Lin Guosheng,Decoupled Spatial Neural Attention for Weakly Supervised Semantic Segmentation.,2018,CoRR
37,Lin Guosheng,Learning Markov Clustering Networks for Scene Text Detection.,2018,CoRR
37,Lin Guosheng,Keypoint Based Weakly Supervised Human Parsing.,2018,CoRR
37,Lin Guosheng,Correlation Propagation Networks for Scene Text Detection.,2018,CoRR
37,Lin Guosheng,M2E-Try On Net: Fashion from Model to Everyone.,2018,CoRR
37,Lin Guosheng,Structured Learning of Binary Codes with Column Generation for Optimizing Ranking Measures.,2017,Int. J. Comput. Vis.
37,Lin Guosheng,Discriminative Training of Deep Fully Connected Continuous CRFs With Task-Specific Loss.,2017,IEEE Trans. Image Process.
37,Lin Guosheng,Learning Multi-level Region Consistency with Dense Multi-label Networks for Semantic Segmentation.,2017,CoRR
37,Lin Guosheng,Efficient Dense Labeling of Human Activity Sequences from Wearables using Fully Convolutional Networks.,2017,CoRR
37,Lin Guosheng,Structured Learning of Tree Potentials in CRF for Image Segmentation.,2017,CoRR
37,Lin Guosheng,Weakly Supervised Semantic Segmentation Based on Co-segmentation.,2017,CoRR
37,Lin Guosheng,Semantic Segmentation from Limited Training Data.,2017,CoRR
37,Lin Guosheng,Learning Depth from Single Monocular Images Using Deep Convolutional Neural Fields.,2016,IEEE Trans. Pattern Anal. Mach. Intell.
37,Lin Guosheng,Discriminative Training of Deep Fully-connected Continuous CRF with Task-specific Loss.,2016,CoRR
37,Lin Guosheng,Structured Learning of Binary Codes with Column Generation.,2016,CoRR
37,Lin Guosheng,Fast Training of Triplet-based Deep Binary Embedding Networks.,2016,CoRR
37,Lin Guosheng,Exploring Context with Deep Structured models for Semantic Segmentation.,2016,CoRR
37,Lin Guosheng,Crowd Counting via Weighted VLAD on Dense Attribute Feature Maps.,2016,CoRR
37,Lin Guosheng,RefineNet: Multi-Path Refinement Networks for High-Resolution Semantic Segmentation.,2016,CoRR
37,Lin Guosheng,Sequential Person Recognition in Photo Albums with a Recurrent Network.,2016,CoRR
37,Lin Guosheng,Supervised Hashing Using Graph Cuts and Boosted Decision Trees.,2015,IEEE Trans. Pattern Anal. Mach. Intell.
37,Lin Guosheng,CRF learning with CNN features for image segmentation.,2015,Pattern Recognit.
37,Lin Guosheng,Learning Depth from Single Monocular Images Using Deep Convolutional Neural Fields.,2015,CoRR
37,Lin Guosheng,CRF Learning with CNN Features for Image Segmentation.,2015,CoRR
37,Lin Guosheng,Efficient piecewise training of deep structured models for semantic segmentation.,2015,CoRR
37,Lin Guosheng,Deeply Learning the Messages in Message Passing Inference.,2015,CoRR
37,Lin Guosheng,StructBoost: Boosting Methods for Predicting Structured Output Variables.,2014,IEEE Trans. Pattern Anal. Mach. Intell.
37,Lin Guosheng,Fast Supervised Hashing with Decision Trees for High-Dimensional Data.,2014,CoRR
37,Lin Guosheng,Optimizing Ranking Measures for Compact Binary Code Learning.,2014,CoRR
37,Lin Guosheng,Supervised Hashing Using Graph Cuts and Boosted Decision Trees.,2014,CoRR
37,Lin Guosheng,Deep Convolutional Neural Fields for Depth Estimation from a Single Image.,2014,CoRR
37,Lin Guosheng,StructBoost: Boosting Methods for Predicting Structured Output Variables,2013,CoRR
37,Lin Guosheng,Learning Hash Functions Using Column Generation,2013,CoRR
37,Lin Guosheng,A General Two-Step Approach to Learning-Based Hashing.,2013,CoRR
37,Lin Guosheng,Fast Training of Effective Multi-class Boosting Using Coordinate Descent Optimization.,2013,CoRR
38,Lin Shang-Wei,A Performance-Sensitive Malware Detection System Using Deep Learning on Mobile Devices.,2021,IEEE Trans. Inf. Forensics Secur.
38,Lin Shang-Wei,A distributed method to avoid higher-order deadlocks in multi-robot systems.,2020,Autom.
38,Lin Shang-Wei,A Performance-Sensitive Malware Detection System Using Deep Learning on Mobile Devices.,2020,CoRR
38,Lin Shang-Wei,Pasadena: Perceptually Aware and Stealthy Adversarial Denoise Attack.,2020,CoRR
38,Lin Shang-Wei,A Survey of Smart Contract Formal Specification and Verification.,2020,CoRR
38,Lin Shang-Wei,Adversarial Exposure Attack on Diabetic Retinopathy Imagery.,2020,CoRR
38,Lin Shang-Wei,SeqMobile: A Sequence Based Efficient Android Malware Detection System Using RNN on Mobile Devices.,2020,CoRR
38,Lin Shang-Wei,A Real-Time and Fully Distributed Approach to Motion Planning for Multirobot Systems.,2019,IEEE Trans. Syst. Man Cybern. Syst.
38,Lin Shang-Wei,Oracle-Supported Dynamic Exploit Generation for Smart Contracts.,2019,CoRR
38,Lin Shang-Wei,A distributed approach to robust control of multi-robot systems.,2018,Autom.
38,Lin Shang-Wei,APIReal: an API recognition and linking approach for online developer forums.,2018,Empir. Softw. Eng.
38,Lin Shang-Wei,The language preservation problem is undecidable for parametric event-recording automata.,2018,Inf. Process. Lett.
38,Lin Shang-Wei,Executable Operational Semantics of Solidity.,2018,CoRR
38,Lin Shang-Wei,K-Rust: An Executable Formal Semantics for Rust.,2018,CoRR
38,Lin Shang-Wei,The language preservation problem is undecidable for parametric event-recording automata.,2018,CoRR
38,Lin Shang-Wei,From verified model to executable program: the PAT approach.,2016,Innov. Syst. Softw. Eng.
38,Lin Shang-Wei,Compositional Reasoning for Shared-variable Concurrent Programs.,2016,CoRR
38,Lin Shang-Wei,Learning Assumptions for CompositionalVerification of Timed Systems.,2014,IEEE Trans. Software Eng.
38,Lin Shang-Wei,Model Checking Prioritized Timed Systems.,2012,IEEE Trans. Computers
38,Lin Shang-Wei,VERTAF/Multi-Core: A SysML-Based Application Framework for Multi-Core Embedded Software Development.,2011,J. Comput. Sci. Technol.
38,Lin Shang-Wei,Counterexample-Guided Assume-Guarantee Synthesis through Learning.,2011,IEEE Trans. Computers
38,Lin Shang-Wei,Real-Time Embedded Software Design for Mobile and Ubiquitous Systems.,2010,J. Signal Process. Syst.
38,Lin Shang-Wei,Modeling and verification of real-time embedded systems with urgency.,2009,J. Syst. Softw.
38,Lin Shang-Wei,Automatic synthesis and verification of real-time embedded software for mobile and ubiquitous systems.,2008,Comput. Lang. Syst. Struct.
38,Lin Shang-Wei,VERTAF: An Application Framework for the Design and Verification of Embedded Real-Time Software.,2004,IEEE Trans. Software Eng.
39,Lin Weisi,Blind image quality prediction with hierarchical feature aggregation.,2021,Inf. Sci.
39,Lin Weisi,Progressive Self-Guided Loss for Salient Object Detection.,2021,CoRR
39,Lin Weisi,Multiscale Natural Scene Statistical Analysis for No-Reference Quality Evaluation of DIBR-Synthesized Views.,2020,IEEE Trans. Broadcast.
39,Lin Weisi,Learning a Unified Blind Image Quality Metric via On-Line and Off-Line Big Training Instances.,2020,IEEE Trans. Big Data
39,Lin Weisi,Statistical and Structural Information Backed Full-Reference Quality Measure of Compressed Sonar Images.,2020,IEEE Trans. Circuits Syst. Video Technol.
39,Lin Weisi,Salient Object Detection by Spatiotemporal and Semantic Features in Real-Time Video Processing Systems.,2020,IEEE Trans. Ind. Electron.
39,Lin Weisi,Toward Intelligent Sensing: Intermediate Deep Feature Compression.,2020,IEEE Trans. Image Process.
39,Lin Weisi,Personality-Assisted Multi-Task Learning for Generic and Personalized Image Aesthetics Assessment.,2020,IEEE Trans. Image Process.
39,Lin Weisi,End-to-End Blind Image Quality Prediction With Cascaded Deep Neural Network.,2020,IEEE Trans. Image Process.
39,Lin Weisi,Deep Dual-Channel Neural Network for Image-Based Smoke Detection.,2020,IEEE Trans. Multim.
39,Lin Weisi,A Dilated Inception Network for Visual Saliency Prediction.,2020,IEEE Trans. Multim.
39,Lin Weisi,GSTO: Gated Scale-Transfer Operation for Multi-Scale Feature Learning in Pixel Labeling.,2020,CoRR
39,Lin Weisi,Pasadena: Perceptually Aware and Stealthy Adversarial Denoise Attack.,2020,CoRR
39,Lin Weisi,Adversarial Exposure Attack on Diabetic Retinopathy Imagery.,2020,CoRR
39,Lin Weisi,Signal-Independent Separable KLT by Offline Training for Video Coding.,2019,IEEE Access
39,Lin Weisi,Video Frame Synthesis via Plug-and-Play Deep Locally Temporal Embedding.,2019,IEEE Access
39,Lin Weisi,Survey of visual just noticeable difference estimation.,2019,Frontiers Comput. Sci.
39,Lin Weisi,Blind image quality assessment based on joint log-contrast statistics.,2019,Neurocomputing
39,Lin Weisi,No-reference image quality assessment with visual pattern degradation.,2019,Inf. Sci.
39,Lin Weisi,Blind image quality assessment with hierarchy: Degradation from local structure to deep semantics.,2019,J. Vis. Commun. Image Represent.
39,Lin Weisi,Reduced-reference quality assessment of image super-resolution by energy change and texture variation.,2019,J. Vis. Commun. Image Represent.
39,Lin Weisi,BLIQUE-TMI: Blind Quality Evaluator for Tone-Mapped Images Based on Local and Global Feature Analyses.,2019,IEEE Trans. Circuits Syst. Video Technol.
39,Lin Weisi,Review of Visual Saliency Detection With Comprehensive Information.,2019,IEEE Trans. Circuits Syst. Video Technol.
39,Lin Weisi,Visual-Quality Guided Global Backlight Dimming for Video Display on Mobile Devices.,2019,IEEE Trans. Circuits Syst. Video Technol.
39,Lin Weisi,An Iterative Co-Saliency Framework for RGBD Images.,2019,IEEE Trans. Cybern.
39,Lin Weisi,Visual-Attention-Based Pixel Dimming Technique for OLED Displays of Mobile Devices.,2019,IEEE Trans. Ind. Electron.
39,Lin Weisi,A Highly Efficient Blind Image Quality Assessment Metric of 3-D Synthesized Images Using Outlier Detection.,2019,IEEE Trans. Ind. Informatics
39,Lin Weisi,Fine-Grained Quality Assessment for Compressed Images.,2019,IEEE Trans. Image Process.
39,Lin Weisi,Deep Visual Saliency on Stereoscopic Images.,2019,IEEE Trans. Image Process.
39,Lin Weisi,A Two-Stage Outlier Filtering Framework for City-Scale Localization Using 3D SfM Point Clouds.,2019,IEEE Trans. Image Process.
39,Lin Weisi,Reference-Free Quality Assessment of Sonar Images via Contour Degradation Measurement.,2019,IEEE Trans. Image Process.
39,Lin Weisi,Point Cloud Saliency Detection by Local and Global Feature Fusion.,2019,IEEE Trans. Image Process.
39,Lin Weisi,Which Has Better Visual Quality: The Clear Blue Sky or a Blurry Animal?,2019,IEEE Trans. Multim.
39,Lin Weisi,Pairwise-Comparison-Based Rank Learning for Benchmarking Image Restoration Algorithms.,2019,IEEE Trans. Multim.
39,Lin Weisi,Quality Assessment for Video With Degradation Along Salient Trajectories.,2019,IEEE Trans. Multim.
39,Lin Weisi,Content-Insensitive Blind Image Blurriness Assessment Using Weibull Statistics and Sparse Extreme Learning Machine.,2019,IEEE Trans. Syst. Man Cybern. Syst.
39,Lin Weisi,Towards Robust Curve Text Detection with Conditional Spatial Expansion.,2019,CoRR
39,Lin Weisi,A Dilated Inception Network for Visual Saliency Prediction.,2019,CoRR
39,Lin Weisi,Learning a No-Reference Quality Assessment Model of Enhanced Images With Big Data.,2019,CoRR
39,Lin Weisi,Cascaded Parallel Filtering for Memory-Efficient Image-Based Localization.,2019,CoRR
39,Lin Weisi,Robustness Analysis of Pedestrian Detectors for Surveillance.,2018,IEEE Access
39,Lin Weisi,Objective Quality Assessment and Perceptual Compression of Screen Content Images.,2018,IEEE Computer Graphics and Applications
39,Lin Weisi,Just Noticeable Difference for natural images using RMS contrast and feed-back mechanism.,2018,Neurocomputing
39,Lin Weisi,A novel distortion criterion of rate-distortion optimization for depth map coding.,2018,J. Vis. Commun. Image Represent.
39,Lin Weisi,Pyramidal modeling of geometric distortions for retargeted image quality evaluation.,2018,Multim. Tools Appl.
39,Lin Weisi,Learning a referenceless stereopair quality engine with deep nonnegativity constrained sparse autoencoder.,2018,Pattern Recognit.
39,Lin Weisi,"'Who Likes What and, Why?' Insights into Modeling Users' Personality Based on Image 'Likes'.",2018,IEEE Trans. Affect. Comput.
39,Lin Weisi,Reduced-Reference Quality Assessment of Screen Content Images.,2018,IEEE Trans. Circuits Syst. Video Technol.
39,Lin Weisi,Toward Domain Transfer for No-Reference Quality Prediction of Asymmetrically Distorted Stereoscopic Images.,2018,IEEE Trans. Circuits Syst. Video Technol.
39,Lin Weisi,Optimal Region Selection for Stereoscopic Video Subtitle Insertion.,2018,IEEE Trans. Circuits Syst. Video Technol.
39,Lin Weisi,Rate-Distortion Optimized Sparse Coding With Ordered Dictionary for Image Set Compression.,2018,IEEE Trans. Circuits Syst. Video Technol.
39,Lin Weisi,Learning Sparse Representation for Objective Image Retargeting Quality Assessment.,2018,IEEE Trans. Cybern.
39,Lin Weisi,A Prediction Backed Model for Quality Assessment of Screen Content and 3-D Synthesized Images.,2018,IEEE Trans. Ind. Informatics
39,Lin Weisi,Recurrent Air Quality Predictor Based on Meteorology- and Pollution-Related Factors.,2018,IEEE Trans. Ind. Informatics
39,Lin Weisi,Model-Based Referenceless Quality Metric of 3D Synthesized Images Using Local Image Description.,2018,IEEE Trans. Image Process.
39,Lin Weisi,Multiple-Level Feature-Based Measure for Retargeted Image Quality.,2018,IEEE Trans. Image Process.
39,Lin Weisi,No Reference Quality Assessment for Screen Content Images With Both Local and Global Feature Representation.,2018,IEEE Trans. Image Process.
39,Lin Weisi,No-Reference View Synthesis Quality Prediction for 3-D Videos Based on Color-Depth Interactions.,2018,IEEE Trans. Multim.
39,Lin Weisi,Quality Assessment of DIBR-Synthesized Images by Measuring Local Geometric Distortions and Global Sharpness.,2018,IEEE Trans. Multim.
39,Lin Weisi,Optimizing Multistage Discriminative Dictionaries for Blind Image Quality Assessment.,2018,IEEE Trans. Multim.
39,Lin Weisi,Learning a No-Reference Quality Assessment Model of Enhanced Images With Big Data.,2018,IEEE Trans. Neural Networks Learn. Syst.
39,Lin Weisi,"Measuring Individual Video QoE: A Survey, and Proposal for Future Directions Using Social Media.",2018,ACM Trans. Multim. Comput. Commun. Appl.
39,Lin Weisi,Evaluating Quality of Screen Content Images Via Structural Variation Analysis.,2018,IEEE Trans. Vis. Comput. Graph.
39,Lin Weisi,Review of Visual Saliency Detection with Comprehensive Information.,2018,CoRR
39,Lin Weisi,Learning Markov Clustering Networks for Scene Text Detection.,2018,CoRR
39,Lin Weisi,Robustness Analysis of Pedestrian Detectors for Surveillance.,2018,CoRR
39,Lin Weisi,Intermediate Deep Feature Compression: the Next Battlefield of Intelligent Sensing.,2018,CoRR
39,Lin Weisi,Performance Evaluation of Visual Tracking Algorithms on Video Sequences With Quality Degradation.,2017,IEEE Access
39,Lin Weisi,Object Tracking Based on Stable Feature Mining Using Intraframe Clustering and Interframe Association.,2017,IEEE Access
39,Lin Weisi,B-SHOT: a binary 3D feature descriptor for fast Keypoint matching on 3D point clouds.,2017,Auton. Robots
39,Lin Weisi,BSD: Blind image quality assessment based on structural degradation.,2017,Neurocomputing
39,Lin Weisi,Effective visual tracking by pairwise metric learning.,2017,Neurocomputing
39,Lin Weisi,Learning visual saliency from human fixations for stereoscopic images.,2017,Neurocomputing
39,Lin Weisi,Quality assessment of retargeted images by salient region deformity analysis.,2017,J. Vis. Commun. Image Represent.
39,Lin Weisi,3DHoPD: A Fast Low-Dimensional 3-D Descriptor.,2017,IEEE Robotics Autom. Lett.
39,Lin Weisi,Low Bit-rate 3D feature descriptors for depth data from Kinect-style sensors.,2017,Signal Process. Image Commun.
39,Lin Weisi,Just-Noticeable Difference-Based Perceptual Optimization for JPEG Compression.,2017,IEEE Signal Process. Lett.
39,Lin Weisi,High-Efficiency Image Coding via Near-Optimal Filtering.,2017,IEEE Signal Process. Lett.
39,Lin Weisi,Multi-Task Rank Learning for Image Quality Assessment.,2017,IEEE Trans. Circuits Syst. Video Technol.
39,Lin Weisi,Low-Rank-Based Nonlocal Adaptive Loop Filter for High-Efficiency Video Compression.,2017,IEEE Trans. Circuits Syst. Video Technol.
39,Lin Weisi,NMF-Based Image Quality Assessment Using Extreme Learning Machine.,2017,IEEE Trans. Cybern.
39,Lin Weisi,Toward Simultaneous Visual Comfort and Depth Sensation Optimization for Stereoscopic 3-D Experience.,2017,IEEE Trans. Cybern.
39,Lin Weisi,No-Reference Quality Metric of Contrast-Distorted Images Based on Information Maximization.,2017,IEEE Trans. Cybern.
39,Lin Weisi,A Fast Reliable Image Quality Predictor by Fusing Micro- and Macro-Structures.,2017,IEEE Trans. Ind. Electron.
39,Lin Weisi,A Data-Driven Point Cloud Simplification Framework for City-Scale Image-Based Localization.,2017,IEEE Trans. Image Process.
