f_index,Faculty,Title,Year,Journal
16,Dusit Niyato,Robust Transmissions in Wireless Powered Multi-Relay Networks with Chance Interference Constraints.,2018,CoRR
16,Dusit Niyato,Joint Transaction Transmission and Channel Selection in Cognitive Radio Based Blockchain Networks: A Deep Reinforcement Learning Approach.,2018,CoRR
16,Dusit Niyato,Network Slicing with Mobile Edge Computing for Micro-Operator Networks in Beyond 5G.,2018,CoRR
16,Dusit Niyato,Deep Reinforcement Learning based Modulation and Coding Scheme Selection in Cognitive Heterogeneous Networks.,2018,CoRR
16,Dusit Niyato,Evolutionary Game for Consensus Provision in Permissionless Blockchain Networks with Shard.,2018,CoRR
16,Dusit Niyato,Joint Service Pricing and Cooperative Relay Communication for Federated Learning.,2018,CoRR
16,Dusit Niyato,Deep Q-Learning for Dynamic Reliability Aware NFV-Based Service Provisioning.,2018,CoRR
16,Dusit Niyato,Efficient Training Management for Mobile Crowd-Machine Learning: A Deep Reinforcement Learning Approach.,2018,CoRR
16,Dusit Niyato,Distributed Deep Learning at the Edge: A Novel Proactive and Cooperative Caching Framework for Mobile Edge Networks.,2018,CoRR
16,Dusit Niyato,Charging and Discharging of Plug-In Electric Vehicles (PEVs) in Vehicle-to-Grid (V2G) Systems: A Cyber Insurance-Based Model.,2017,IEEE Access
16,Dusit Niyato,Impact of the Wireless Network's PHY Security and Reliability on Demand-Side Management Cost in the Smart Grid.,2017,IEEE Access
16,Dusit Niyato,Practical Perspectives on IoT in 5G Networks: From Theory to Industrial Challenges and Business Opportunities.,2017,IEEE Commun. Mag.
16,Dusit Niyato,The Accuracy-Privacy Trade-off of Mobile Crowdsensing.,2017,IEEE Commun. Mag.
16,Dusit Niyato,A Hierarchical Game Framework for Resource Management in Fog Computing.,2017,IEEE Commun. Mag.
16,Dusit Niyato,Resource Management in Cloud Networking Using Economic Analysis and Pricing Models: A Survey.,2017,IEEE Commun. Surv. Tutorials
16,Dusit Niyato,Applications of Economic and Pricing Models for Wireless Network Security: A Survey.,2017,IEEE Commun. Surv. Tutorials
16,Dusit Niyato,Editorial of ETT Special Issue: emerging topics in device to device communications as enabling technology for 5G systems.,2017,Trans. Emerg. Telecommun. Technol.
16,Dusit Niyato,Security of an Ordered-Based Distributive Jamming Scheme.,2017,IEEE Commun. Lett.
16,Dusit Niyato,Computing Resource Allocation in Three-Tier IoT Fog Networks: A Joint Optimization Approach Combining Stackelberg Game and Matching.,2017,IEEE Internet Things J.
16,Dusit Niyato,Public Cloud Storage-Assisted Mobile Social Video Sharing: A Supermodular Game Approach.,2017,IEEE J. Sel. Areas Commun.
16,Dusit Niyato,Workload Factoring and Resource Sharing via Joint Vertical and Horizontal Cloud Federation Networks.,2017,IEEE J. Sel. Areas Commun.
16,Dusit Niyato,Privacy Management and Optimal Pricing in People-Centric Sensing.,2017,IEEE J. Sel. Areas Commun.
16,Dusit Niyato,Spectrum Allocation and Bitrate Adjustment for Mobile Social Video Sharing: Potential Game With Online QoS Learning Approach.,2017,IEEE J. Sel. Areas Commun.
16,Dusit Niyato,Cyber Insurance for Plug-In Electric Vehicle Charging in Vehicle-to-Grid Systems.,2017,IEEE Netw.
16,Dusit Niyato,Optimal Data Scheduling and Admission Control for Backscatter Sensor Networks.,2017,IEEE Trans. Commun.
16,Dusit Niyato,Ambient Backscatter: A New Approach to Improve Network Performance for RF-Powered Cognitive Radio Networks.,2017,IEEE Trans. Commun.
16,Dusit Niyato,Routing Multiple Vehicles Cooperatively: Minimizing Road Network Breakdown Probability.,2017,IEEE Trans. Emerg. Top. Comput. Intell.
16,Dusit Niyato,"Offloading in HetNet: A Coordination of Interference Mitigation, User Association, and Resource Allocation.",2017,IEEE Trans. Mob. Comput.
16,Dusit Niyato,Joint Optimization of Resource Provisioning in Cloud Computing.,2017,IEEE Trans. Serv. Comput.
16,Dusit Niyato,A Coalition Formation Game for Remote Radio Head Cooperation in Cloud Radio Access Network.,2017,IEEE Trans. Veh. Technol.
16,Dusit Niyato,Optimal Wireless Energy Charging for Incentivized Content Transfer in Mobile Publish-Subscribe Networks.,2017,IEEE Trans. Veh. Technol.
16,Dusit Niyato,Cooperative Management in Full-Truckload and Less-Than-Truckload Vehicle System.,2017,IEEE Trans. Veh. Technol.
16,Dusit Niyato,Fast Adaptation of Activity Sensing Policies in Mobile Devices.,2017,IEEE Trans. Veh. Technol.
16,Dusit Niyato,Resource Allocation in Wireless Powered Relay Networks: A Bargaining Game Approach.,2017,IEEE Trans. Veh. Technol.
16,Dusit Niyato,Mobile Charging in Wireless-Powered Sensor Networks: Optimal Scheduling and Experimental Implementation.,2017,IEEE Trans. Veh. Technol.
16,Dusit Niyato,Performance Analysis of Multihop Relaying Systems in an α-Ginibre Field of Interferers.,2017,IEEE Trans. Veh. Technol.
16,Dusit Niyato,Matching Theory for Distributed User Association and Resource Allocation in Cognitive Femtocell Networks.,2017,IEEE Trans. Veh. Technol.
16,Dusit Niyato,A Multi-Leader Multi-Follower Stackelberg Game for Resource Management in LTE Unlicensed.,2017,IEEE Trans. Wirel. Commun.
16,Dusit Niyato,Modeling and Analysis of Wireless Sensor Networks With/Without Energy Harvesting Using Ginibre Point Processes.,2017,IEEE Trans. Wirel. Commun.
16,Dusit Niyato,Wireless Energy Harvesting Sensor Networks: Boolean-Poisson Modeling and Analysis.,2017,IEEE Trans. Wirel. Commun.
16,Dusit Niyato,Analysis of Heterogeneous Wireless Networks Using Poisson Hard-Core Hole Process.,2017,IEEE Trans. Wirel. Commun.
16,Dusit Niyato,Pricing and Rate Optimization of Cloud Radio Access Network Using Robust Hierarchical Dynamic Game.,2017,IEEE Trans. Wirel. Commun.
16,Dusit Niyato,Dynamic Spectrum Management for 5G.,2017,IEEE Wirel. Commun.
16,Dusit Niyato,Wireless Powered Communication Networks: Research Directions and Technological Approaches.,2017,IEEE Wirel. Commun.
16,Dusit Niyato,On Transmission Mode Selection in D2D-Enhanced Small Cell Networks.,2017,IEEE Wirel. Commun. Lett.
16,Dusit Niyato,Charging and Discharging of Plug-In Electric Vehicles (PEVs) in Vehicle-to-Grid (V2G) Systems: A Cyber Insurance-Based Model.,2017,CoRR
16,Dusit Niyato,Resource Management in Cloud Networking Using Economic Analysis and Pricing Models: A Survey.,2017,CoRR
16,Dusit Niyato,Computing Resource Allocation in Three-Tier IoT Fog Networks: a Joint Optimization Approach Combining Stackelberg Game and Matching.,2017,CoRR
16,Dusit Niyato,Multi-Dimensional Payment Plan in Fog Computing with Moral Hazard.,2017,CoRR
16,Dusit Niyato,The Accuracy-Privacy Tradeoff of Mobile Crowdsensing.,2017,CoRR
16,Dusit Niyato,Privacy Management and Optimal Pricing in People-Centric Sensing.,2017,CoRR
16,Dusit Niyato,Profit Maximization Auction and Data Management in Big Data Markets.,2017,CoRR
16,Dusit Niyato,Applications of Economic and Pricing Models for Wireless Network Security: A Survey.,2017,CoRR
16,Dusit Niyato,Analysis of Wireless-Powered Device-to-Device Communications with Ambient Backscattering.,2017,CoRR
16,Dusit Niyato,Cyber Insurance for Heterogeneous Wireless Networks.,2017,CoRR
16,Dusit Niyato,Ambient Backscatter Networking: A Novel Paradigm to Assist Wireless Powered Communications.,2017,CoRR
16,Dusit Niyato,Edge Computing Resource Management and Pricing for Mobile Blockchain.,2017,CoRR
16,Dusit Niyato,Applications of Economic and Pricing Models for Resource Management in 5G Wireless Networks: A Survey.,2017,CoRR
16,Dusit Niyato,Social Welfare Maximization Auction in Edge Computing Resource Allocation for Mobile Blockchain.,2017,CoRR
16,Dusit Niyato,Optimal Pricing-Based Edge Computing Resource Management in Mobile Blockchain.,2017,CoRR
16,Dusit Niyato,A Socially-Aware Incentive Mechanism for Mobile Crowdsensing Service Market.,2017,CoRR
16,Dusit Niyato,Competition and Cooperation Analysis for Data Sponsored Market: A Network Effects Model.,2017,CoRR
16,Dusit Niyato,Optimal Auction For Edge Computing Resource Management in Mobile Blockchain Networks: A Deep Learning Approach.,2017,CoRR
16,Dusit Niyato,When Mobile Blockchain Meets Edge Computing: Challenges and Applications.,2017,CoRR
16,Dusit Niyato,Evolutionary Game for Mining Pool Selection in Blockchain Networks.,2017,CoRR
16,Dusit Niyato,Wireless-Powered Device-to-Device Communications with Ambient Backscattering: Performance Modeling and Analysis.,2017,CoRR
16,Dusit Niyato,Performance Analysis and Application of Mobile Blockchain.,2017,CoRR
16,Dusit Niyato,Ambient Backscatter Communications: A Contemporary Survey.,2017,CoRR
16,Dusit Niyato,Optimal Cross Slice Orchestration for 5G Mobile Services.,2017,CoRR
16,Dusit Niyato,A Stochastic Programming Approach for Risk Management in Mobile Cloud Computing.,2017,CoRR
16,Dusit Niyato,Cyberattack Detection in Mobile Cloud Computing: A Deep Learning Approach.,2017,CoRR
16,Dusit Niyato,One-Hop Out-of-Band Control Planes for Low-Power Multi-Hop Wireless Networks.,2017,CoRR
16,Dusit Niyato,Dynamic Energy Trading for Wireless Powered Communication Networks.,2016,IEEE Commun. Mag.
16,Dusit Niyato,"Wireless Charging Technologies: Fundamentals, Standards, and Network Applications.",2016,IEEE Commun. Surv. Tutorials
16,Dusit Niyato,A Survey on Applications of Model-Free Strategy Learning in Cognitive Wireless Networks.,2016,IEEE Commun. Surv. Tutorials
16,Dusit Niyato,Data Collection and Wireless Communication in Internet of Things (IoT) Using Economic Analysis and Pricing Models: A Survey.,2016,IEEE Commun. Surv. Tutorials
16,Dusit Niyato,Artificial-Noise-Aided Secure MIMO Full-Duplex Relay Channels With Fixed-Power Transmissions.,2016,IEEE Commun. Lett.
16,Dusit Niyato,Dynamics of service selection and provider pricing game in heterogeneous cloud market.,2016,J. Netw. Comput. Appl.
16,Dusit Niyato,Self-Sustainable Communications With RF Energy Harvesting: Ginibre Point Process Modeling and Analysis.,2016,IEEE J. Sel. Areas Commun.
16,Dusit Niyato,Exact Performance Analysis of Ambient RF Energy Harvesting Wireless Sensor Networks With Ginibre Point Process.,2016,IEEE J. Sel. Areas Commun.
16,Dusit Niyato,Smart data pricing models for the internet of things: a bundling strategy approach.,2016,IEEE Netw.
16,Dusit Niyato,Mobile big data analytics using deep learning and apache spark.,2016,IEEE Netw.
16,Dusit Niyato,Finding the Shortest Path in Stochastic Vehicle Routing: A Cardinality Minimization Approach.,2016,IEEE Trans. Intell. Transp. Syst.
16,Dusit Niyato,Auction Mechanisms Toward Efficient Resource Sharing for Cloudlets in Mobile Cloud Computing.,2016,IEEE Trans. Serv. Comput.
16,Dusit Niyato,The PHEV Charging Scheduling and Power Supply Optimization for Charging Stations.,2016,IEEE Trans. Veh. Technol.
16,Dusit Niyato,Stackelberg Bayesian Game for Power Allocation in Two-Tier Networks.,2016,IEEE Trans. Veh. Technol.
16,Dusit Niyato,Mobile Energy Sharing Networks: Performance Analysis and Optimization.,2016,IEEE Trans. Veh. Technol.
16,Dusit Niyato,Optimal Energy Management Policy of Mobile Energy Gateway.,2016,IEEE Trans. Veh. Technol.
16,Dusit Niyato,Improving the Efficiency of Stochastic Vehicle Routing: A Partial Lagrange Multiplier Method.,2016,IEEE Trans. Veh. Technol.
16,Dusit Niyato,Double-Sided Bandwidth-Auction Game for Cognitive Device-to-Device Communication in Cellular Networks.,2016,IEEE Trans. Veh. Technol.
16,Dusit Niyato,Zero-Determinant Strategy for Resource Sharing in Wireless Cooperations.,2016,IEEE Trans. Wirel. Commun.
16,Dusit Niyato,Offloading in Software Defined Network at Edge with Information Asymmetry: A Contract Theoretical Approach.,2016,J. Signal Process. Syst.
16,Dusit Niyato,"Wireless powered communication networks: architectures, protocol designs, and standardization [Guest Editorial].",2016,IEEE Wirel. Commun.
16,Dusit Niyato,Enhance device-to-device communication with social awareness: a belief-based stable marriage game framework.,2016,IEEE Wirel. Commun.
16,Dusit Niyato,Economics of Internet of Things: an information market approach.,2016,IEEE Wirel. Commun.
16,Dusit Niyato,Security of Rechargeable Energy-Harvesting Transmitters in Wireless Networks.,2016,IEEE Wirel. Commun. Lett.
16,Dusit Niyato,Enhancing the PHY-Layer Security of MIMO Buffer-Aided Relay Networks.,2016,IEEE Wirel. Commun. Lett.
16,Dusit Niyato,Market Model and Optimal Pricing Scheme of Big Data and Internet of Things (IoT).,2016,CoRR
16,Dusit Niyato,Mobile Big Data Analytics Using Deep Learning and Apache Spark.,2016,CoRR
16,Dusit Niyato,Learning for Robust Routing Based on Stochastic Game in Cognitive Radio Networks.,2016,CoRR
16,Dusit Niyato,Rate-distortion Balanced Data Compression for Wireless Sensor Networks.,2016,CoRR
16,Dusit Niyato,The Tradeoff Analysis in RF-Powered Backscatter Cognitive Radio Networks.,2016,CoRR
16,Dusit Niyato,Data Collection and Wireless Communication in Internet of Things (IoT) Using Economic Analysis and Pricing Models: A Survey.,2016,CoRR
16,Dusit Niyato,Single Controller Stochastic Games for Optimized Moving Target Defense.,2016,CoRR
16,Dusit Niyato,Fast Adaptation of Activity Sensing Policies in Mobile Devices.,2016,CoRR
16,Dusit Niyato,Resource Allocation in Wireless Powered Relay Networks: A Bargaining Game Approach.,2016,CoRR
16,Dusit Niyato,Security of Rechargeable Energy-Harvesting Transmitters in Wireless Networks.,2016,CoRR
16,Dusit Niyato,A Survey on Software-Defined Networking.,2015,IEEE Commun. Surv. Tutorials
16,Dusit Niyato,Wireless Networks With RF Energy Harvesting: A Contemporary Survey.,2015,IEEE Commun. Surv. Tutorials
16,Dusit Niyato,Markov Decision Processes With Applications in Wireless Sensor Networks: A Survey.,2015,IEEE Commun. Surv. Tutorials
16,Dusit Niyato,Applications of Repeated Games in Wireless Networks: A Survey.,2015,IEEE Commun. Surv. Tutorials
16,Dusit Niyato,"Guest Editorial: Recent Advances in Heterogeneous Cellular Networks, Part I.",2015,IEEE J. Sel. Areas Commun.
16,Dusit Niyato,"Guest Editorial Recent Advances in Heterogeneous Cellular Networks, Part II.",2015,IEEE J. Sel. Areas Commun.
16,Dusit Niyato,Dynamic Energy Trading for Energy Harvesting Communication Networks: A Stochastic Energy Trading Game.,2015,IEEE J. Sel. Areas Commun.
16,Dusit Niyato,Resource allocation in wireless networks with RF energy harvesting and transfer.,2015,IEEE Netw.
16,Dusit Niyato,QoS-aware cell association in 5G heterogeneous networks with massive MIMO.,2015,IEEE Netw.
16,Dusit Niyato,A DEC-MDP model for joint uplink/downlink resource management in OFDMA-based networks.,2015,Phys. Commun.
16,Dusit Niyato,Performance Analysis of Wireless Energy Harvesting Cognitive Radio Networks Under Smart Jamming Attacks.,2015,IEEE Trans. Cogn. Commun. Netw.
16,Dusit Niyato,Offloading in Mobile Cloudlet Systems with Intermittent Connectivity.,2015,IEEE Trans. Mob. Comput.
16,Dusit Niyato,A Real-Time Group Auction System for Efficient Allocation of Cloud Internet Applications.,2015,IEEE Trans. Serv. Comput.
16,Dusit Niyato,Radio Resource Management for Group-Oriented Services in LTE-A.,2015,IEEE Trans. Veh. Technol.
16,Dusit Niyato,Cooperation in Delay-Tolerant Networks With Wireless Energy Transfer: Performance Analysis and Optimization.,2015,IEEE Trans. Veh. Technol.
16,Dusit Niyato,Performance Optimization for Cooperative Multiuser Cognitive Radio Networks with RF Energy Harvesting Capability.,2015,IEEE Trans. Wirel. Commun.
16,Dusit Niyato,Performance Analysis of Ambient RF Energy Harvesting with Repulsive Point Process Modeling.,2015,IEEE Trans. Wirel. Commun.
16,Dusit Niyato,"Wireless charger networking for mobile devices: fundamentals, standards, and applications.",2015,IEEE Wirel. Commun.
16,Dusit Niyato,Evolution and future trends of research in cognitive radio: a contemporary survey.,2015,Wirel. Commun. Mob. Comput.
16,Dusit Niyato,Deferrable load scheduling under imperfect data communication channel.,2015,Wirel. Commun. Mob. Comput.
16,Dusit Niyato,Hierarchical Cooperation for Operator-Controlled Device-to-Device Communications: A Layered Coalitional Game Approach.,2015,CoRR
16,Dusit Niyato,Markov Decision Processes with Applications in Wireless Sensor Networks: A Survey.,2015,CoRR
16,Dusit Niyato,Performance Analysis of Simultaneous Wireless Information and Power Transfer with Ambient RF Energy Harvesting.,2015,CoRR
16,Dusit Niyato,Applications of Repeated Games in Wireless Networks: A Survey.,2015,CoRR
16,Dusit Niyato,Optimal Energy Allocation Policy for Wireless Networks in the Sky.,2015,CoRR
16,Dusit Niyato,A Survey on Applications of Model-Free Strategy Learning in Cognitive Wireless Networks.,2015,CoRR
16,Dusit Niyato,Performance Analysis of Ambient RF Energy Harvesting with Repulsive Point Process Modeling.,2015,CoRR
16,Dusit Niyato,Toward a Robust Sparse Data Representation for Wireless Sensor Networks.,2015,CoRR
16,Dusit Niyato,"Wireless Charging Technologies: Fundamentals, Standards, and Network Applications.",2015,CoRR
16,Dusit Niyato,Offloading in Software Defined Network at Edge with Information Asymmetry: A Contract Theoretical Approach.,2015,CoRR
16,Dusit Niyato,Economics of Internet of Things (IoT): An Information Market Approach.,2015,CoRR
16,Dusit Niyato,Deep Activity Recognition Models with Triaxial Accelerometers.,2015,CoRR
16,Dusit Niyato,Smart Data Pricing Models for Internet-of-Things (IoT): A Bundling Strategy Approach.,2015,CoRR
16,Dusit Niyato,"Machine Learning in Wireless Sensor Networks: Algorithms, Strategies, and Applications.",2014,IEEE Commun. Surv. Tutorials
16,Dusit Niyato,Secondary Users Entering the Pool: A Joint Optimization Framework for Spectrum Pooling.,2014,IEEE J. Sel. Areas Commun.
16,Dusit Niyato,Opportunistic Channel Access and RF Energy Harvesting in Cognitive Radio Networks.,2014,IEEE J. Sel. Areas Commun.
16,Dusit Niyato,"Pricing, Spectrum Sharing, and Service Selection in Two-Tier Small Cell Networks: A Hierarchical Dynamic Game Approach.",2014,IEEE Trans. Mob. Comput.
16,Dusit Niyato,Cooperative Virtual Machine Management in Smart Grid Environment.,2014,IEEE Trans. Serv. Comput.
16,Dusit Niyato,A Layered Coalitional Game Framework of Wireless Relay Network.,2014,IEEE Trans. Veh. Technol.
16,Dusit Niyato,Delay-Limited Communications of Mobile Node With Wireless Energy Harvesting: Performance Analysis and Optimization.,2014,IEEE Trans. Veh. Technol.
16,Dusit Niyato,Performance Modeling and Analysis of Heterogeneous Machine Type Communications.,2014,IEEE Trans. Wirel. Commun.
16,Dusit Niyato,Performance Analysis and Optimization of TDMA Network With Wireless Energy Transfer.,2014,IEEE Trans. Wirel. Commun.
16,Dusit Niyato,Dynamic spectrum access in cognitive radio networks with RF energy harvesting.,2014,IEEE Wirel. Commun.
16,Dusit Niyato,Game-theoretic resource allocation methods for device-to-device communication.,2014,IEEE Wirel. Commun.
16,Dusit Niyato,Medium Access Control for dynamic spectrum access in cognitive radio networks: analysis under uncertainty.,2014,Wirel. Commun. Mob. Comput.
16,Dusit Niyato,"Smart grid sensor data collection, communication, and networking: a tutorial.",2014,Wirel. Commun. Mob. Comput.
16,Dusit Niyato,A hierarchical framework of dynamic relay selection for mobile users and profit maximization for service providers in wireless relay networks.,2014,Wirel. Commun. Mob. Comput.
16,Dusit Niyato,Dynamic Spectrum Access in Cognitive Radio Networks with RF Energy Harvesting.,2014,CoRR
16,Dusit Niyato,A Layered Coalitional Game Framework of Wireless Relay Network.,2014,CoRR
16,Dusit Niyato,Payoff Allocation of Service Coalition in Wireless Mesh Network: A Cooperative Game Perspective.,2014,CoRR
16,Dusit Niyato,Adaptive Power Management for Wireless Base Station in Smart Grid Environment.,2014,CoRR
16,Dusit Niyato,Game-theoretic Resource Allocation Methods for Device-to-Device (D2D) Communication.,2014,CoRR
16,Dusit Niyato,Performance Analysis of Ambient RF Energy Harvesting: A Stochastic Geometry Approach.,2014,CoRR
16,Dusit Niyato,Area Coverage Under Low Sensor Density.,2014,CoRR
16,Dusit Niyato,"Machine Learning in Wireless Sensor Networks: Algorithms, Strategies, and Applications.",2014,CoRR
16,Dusit Niyato,Resource Allocation in Wireless Networks with RF Energy Harvesting and Transfer.,2014,CoRR
16,Dusit Niyato,Wireless Networks with RF Energy Harvesting: A Contemporary Survey.,2014,CoRR
16,Dusit Niyato,Efficient Data Compression with Error Bound Guarantee in Wireless Sensor Networks.,2014,CoRR
16,Dusit Niyato,"Wireless Charger Networking for Mobile Devices: Fundamentals, Standards, and Applications.",2014,CoRR
16,Dusit Niyato,Random access for machine-to-machine communication in LTE-advanced networks: issues and approaches.,2013,IEEE Commun. Mag.
16,Dusit Niyato,Auction Approaches for Resource Allocation in Wireless Systems: A Survey.,2013,IEEE Commun. Surv. Tutorials
16,Dusit Niyato,On Measuring Disturbances in the Force: Advanced Cloud Monitoring Systems.,2013,Future Gener. Comput. Syst.
16,Dusit Niyato,A Framework for Cooperative Resource Management in Mobile Cloud Computing.,2013,IEEE J. Sel. Areas Commun.
16,Dusit Niyato,Coalition-Based Cooperative Packet Delivery under Uncertainty: A Dynamic Bayesian Coalitional Game.,2013,IEEE Trans. Mob. Comput.
16,Dusit Niyato,Cooperative Packet Delivery in Hybrid Wireless Mobile Networks: A Coalitional Game Approach.,2013,IEEE Trans. Mob. Comput.
16,Dusit Niyato,Optimizations of Power Consumption and Supply in the Smart Grid: Analysis of the Impact of Data Communication Reliability.,2013,IEEE Trans. Smart Grid
16,Dusit Niyato,QoS-Aware and Energy-Efficient Resource Management in OFDMA Femtocells.,2013,IEEE Trans. Wirel. Commun.
16,Dusit Niyato,Hierarchical Competition for Downlink Power Allocation in OFDMA Femtocell Networks.,2013,IEEE Trans. Wirel. Commun.
16,Dusit Niyato,Dynamic Coalition Formation for Network MIMO in Small Cell Networks.,2013,IEEE Trans. Wirel. Commun.
16,Dusit Niyato,A hierarchical cooperation formation model for downlink data transmission in mobile infostation networks.,2013,IEEE Wirel. Commun.
16,Dusit Niyato,"A survey of mobile cloud computing: architecture, applications, and approaches.",2013,Wirel. Commun. Mob. Comput.
16,Dusit Niyato,A Real-time Group Auction System for Efficient Allocation of Cloud Internet Applications,2013,CoRR
16,Dusit Niyato,An Auction Mechanism for Resource Allocation in Mobile Cloud Computing Systems,2013,CoRR
16,Dusit Niyato,Cooperative transmission for meter data collection in smart grid.,2012,IEEE Commun. Mag.
16,Dusit Niyato,Auction-based resource allocation in cognitive radio systems.,2012,IEEE Commun. Mag.
16,Dusit Niyato,Special issue on communications and networking for the smart grid.,2012,J. Commun. Networks
16,Dusit Niyato,Dynamic Service Selection and Bandwidth Allocation in IEEE 802.16m Mobile Relay Networks.,2012,IEEE J. Sel. Areas Commun.
16,Dusit Niyato,Defeating Primary User Emulation Attacks Using Belief Propagation in Cognitive Radio Networks.,2012,IEEE J. Sel. Areas Commun.
16,Dusit Niyato,Optimization of Resource Provisioning Cost in Cloud Computing.,2012,IEEE Trans. Serv. Comput.
16,Dusit Niyato,Performance Analysis of Cognitive Radio Spectrum Access With Prioritized Traffic.,2012,IEEE Trans. Veh. Technol.
16,Dusit Niyato,Dynamic Spectrum Leasing and Service Selection in Spectrum Secondary Market of Cognitive Radio Networks.,2012,IEEE Trans. Wirel. Commun.
16,Dusit Niyato,A Dynamic Offloading Algorithm for Mobile Computing.,2012,IEEE Trans. Wirel. Commun.
16,Dusit Niyato,Reliability analysis and redundancy design of smart grid wireless communications system for demand side management.,2012,IEEE Wirel. Commun.
16,Dusit Niyato,Adaptive power management for wireless base stations in a smart grid environment.,2012,IEEE Wirel. Commun.
16,Dusit Niyato,Decomposition of Stochastic Power Management for Wireless Base Station in Smart Grid.,2012,IEEE Wirel. Commun. Lett.
16,Dusit Niyato,Channel status prediction for cognitive radio networks.,2012,Wirel. Commun. Mob. Comput.
16,Dusit Niyato,Machine-to-machine communications for home energy management system in smart grid.,2011,IEEE Commun. Mag.
16,Dusit Niyato,Distributed resource allocation in wireless networks under uncertainty and application of Bayesian game.,2011,IEEE Commun. Mag.
16,Dusit Niyato,Game Theoretic Approaches for Multiple Access in Wireless Networks: A Survey.,2011,IEEE Commun. Surv. Tutorials
16,Dusit Niyato,Coalition Formation Games for Distributed Cooperation Among Roadside Units in Vehicular Networks.,2011,IEEE J. Sel. Areas Commun.
16,Dusit Niyato,"Applications, Architectures, and Protocol Design Issues for Mobile Social Networks: A Survey.",2011,Proc. IEEE
16,Dusit Niyato,Optimal Channel Access Management with QoS Support for Cognitive Vehicular Networks.,2011,IEEE Trans. Mob. Comput.
16,Dusit Niyato,Performance Evaluation of IPTV Over Wireless Home Networks.,2011,IEEE Trans. Multim.
16,Dusit Niyato,Controlled Coalitional Games for Cooperative Mobile Social Networks.,2011,IEEE Trans. Veh. Technol.
16,Dusit Niyato,A Novel Spectrum-Scheduling Scheme for Multichannel Cognitive Radio Network and Performance Analysis.,2011,IEEE Trans. Veh. Technol.
16,Dusit Niyato,Optimizing Training-Based Transmission Against Smart Jamming.,2011,IEEE Trans. Veh. Technol.
16,Dusit Niyato,Game Theoretic Analysis for Spectrum Sharing with Multi-Hop Relaying.,2011,IEEE Trans. Wirel. Commun.
16,Dusit Niyato,A Simple Distributed Power Control Algorithm for Cognitive Radio Networks.,2011,IEEE Trans. Wirel. Commun.
16,Dusit Niyato,Mobility and handoff management in vehicular networks: a survey.,2011,Wirel. Commun. Mob. Comput.
16,Dusit Niyato,A Survey of Trust and Reputation Management Systems in Wireless Communications.,2010,Proc. IEEE
16,Dusit Niyato,A Microeconomic Model for Hierarchical Bandwidth Sharing in Dynamic Spectrum Access Networks.,2010,IEEE Trans. Computers
